title,url,date,source,summary,cover,aid,appmsgid,score,reason,value
《华中区域省间电力中长期市场实施细则》印发,https://www.escn.com.cn/news/show-2244454.html,2026-03-30,中国储能网,,,,,7,这是唯一含实质性内容的文章：明确交代了政策文件名称、发布主体（国家能源局华中监管局）、参与单位（国网华中分部）、核心意义（标准化、市场化、支撑全国统一电力市场），并点出制度定位（填补区域规则空白）和战略依据（国家重大战略、七省电网格局）。虽因截断未展示细则条款，但已包含权威信源（《国家电网报》）、作者署名、发布时间及专业语境（省间中长期交易、资源优化配置），信息可信度高、时效性强（2026-03-30）、相关性突出（电力市场改革关键节点）。深度受限于文本截断，但基础信息完整，具备政策跟踪与行业研究的实用起点价值。,中
广西首次开展独立储能电站竞价参与电力现货交易,https://www.escn.com.cn/news/show-2244416.html,2026-03-30,中国储能网,,,,,8,信息价值高：报道广西首次实现独立储能电站以‘报量报价’方式参与南方区域电力现货市场，属全国性制度突破，具有标杆意义；时效性强（2026-03-30发布，事件发生于3月17日），且含具体运行数据（两充两放、66万kWh充电量、55万kWh放电量、66万kWh清洁能源消纳增量）；深度中上：虽因截断缺失技术细节与政策背景延伸分析，但已清晰呈现交易机制（分段价量曲线、安全约束出清）、运营模式转变（全市场化阶段）及系统价值（匹配调节需求、提升利用率）；相关性极强——紧扣新型电力系统建设核心议题（储能市场化、现货机制适配）；实用性高：为地方政府、电网公司、储能投资方及交易机构提供可复制的实操范本。扣分点在于原文被截断，缺乏专家解读、后续实施路径及风险挑战分析。,高
三部门启动综合应用试点  氢能从“单一示范”迈向“多元生态”,https://www.escn.com.cn/news/show-2244408.html,2026-03-30,中国储能网,,,,,7,信息价值较高：三部委联合启动氢能综合应用试点是重大政策信号，明确‘揭榜挂帅’机制、城市群遴选标准及2030年量化目标（10万辆燃料电池汽车），体现国家层面对氢能从示范走向产业化的战略升级；时效性好（2026-03-30发布，政策3月16日出台）；深度中等：引述《通知》要点和行业反响，但未展开试点城市群候选名单、氢能多元应用场景（交通/工业/建筑）的具体落地路径、制储运加环节协同难点等；相关性较强——氢能是双碳关键支撑技术，与储能、电力市场共同构成新型能源体系支柱；实用性中等：为地方政府申报试点、企业布局氢能生态提供政策依据，但缺乏实施细则与配套支持措施说明。截断导致关键专家观点和产业影响分析缺失，影响深度与实操指导性。,中
透视广东电力市场：3大规则配套“136号文”，分时电价或将进一步优化,https://www.escn.com.cn/news/show-2244029.html,2026-03-26,中国储能网,,,,,6,信息价值中等：聚焦广东电力市场这一改革高地，关联‘136号文’及三大配套规则，提出分时电价优化预期，具备政策解读价值；时效性良好（2026-03-26发布），且含2024年关键数据（6176.2亿千瓦时现货交易量、近10万家主体），佐证市场成熟度；深度不足：原文严重截断（止于‘《南方电力’），缺失对三大规则具体内容、136号文在广东的落地差异、分时电价优化方向（峰谷差扩大？尖峰时段增设？）等核心分析；相关性较强（电力市场化是能源转型主线），但局限于省级视角，普适性弱于全国性政策；实用性受限：从业者需知悉规则变化，但当前内容仅提供框架性提示，无操作指引或影响预判。信息完整性差显著拉低价值等级。,中
四问！读懂《推动物联网产业创新发展行动方案（2026—2028年）》,https://www.gkzhan.com/news/detail/190805.html,03月31日,智能制造网,,,,,5,标题《四问！读懂〈推动物联网产业创新发展行动方案（2026—2028年）〉》表明其为政策解读类深度稿件，采用‘问答体’形式，具备结构化传播优势；来源与文章5一致，属行业垂直媒体；日期‘03月31日’（虽缺年份，但结合方案名称中‘2026—2028年’可合理推断为2026年发布，时效性较强）。然而摘要仅展示登录界面代码，无任何‘四问’具体内容（如‘为何出台？目标是什么？重点任务有哪些？如何保障落实？’等），导致深度、实用性无法体现。相较于文章3，其标题已暗示分析框架，信息组织意图更清晰，故略高于文章3，但仍因内容真空而难以支撑中高价值判断。,低
工信部等九部门联合印发《推动物联网产业创新发展行动方案（2026—2028年）》,https://www.gkzhan.com/news/detail/190804.html,03月31日,智能制造网,,,,,7,标题明确指出工信部等九部门联合印发国家级物联网产业专项方案（2026—2028年），属重大跨部门产业政策，信息层级高、权威性强；来源为智能制造网（虽非第一发布源，但作为行业主流媒体转载具有传播效力）；日期‘03月31日’与方案名称时间逻辑自洽，时效性良好（属最新政策发布动态）。尽管摘要仍为登录弹窗代码，但该标题本身已包含核心要素：发文主体（工信部+八部门）、政策名称、有效期，具备明确的政策识别度与检索价值；用户可据此精准溯源原始文件（如工信部官网公告），具备强线索性与实务参考价值（如企业申报、地方配套、投资研判）。在五维度中，信息价值（高权威政策）、时效性（即时）、相关性（物联网/新型工业化核心议题）突出，仅因摘要缺失导致深度与实用性暂未展现，但潜力显著。,中
一文读懂《中华人民共和国生态环境法典》,https://www.ccnta.cn/article/24594.html,2026-03-26,中国核技术网,,,,,9,信息价值极高：完整呈现我国首部《生态环境法典》的核心要素——立法进程（2026年3月12日通过、8月15日施行）、结构创新（5编1242条）、系统整合范围（30余部单行法）、七大制度亮点（尤其‘绿色低碳发展独立成编’‘三线一单法定化’‘放射性污染防治新机制’等突破性设计）。时效性极强（发布于法典通过后第14天，且日期为2026-03-26，属前瞻性权威报道）。深度突出：既有宏观定位（‘第二部法典’‘根本性法治保障’），又有微观落地（如第六百一十一条至六百一十六条对核技术领域的精准增补）。相关性覆盖政府监管、环保企业、核工业单位、法律实务及公众维权。实用性明确：提供可操作指引（如噪声/异味污染细化条款）、责任预警（按日计罚、惩罚性赔偿）、参与路径（公众监督机制）。唯一扣分点在于原文被截断（‘四是增加规定’后中断），略损完整性，但主体信息已充分支撑决策与研究。,高
